PMID	Title	Authors	Citation	First.Author	Journal.Book	Publication.Year	Create.Date	PMCID	NIHMS.ID	DOI	Data Available	Open Access	Code Available	Notes
17074949	Dysfunctional prefrontal regional specialization and compensation in schizophrenia	Tan HY, Sust S, Buckholtz JW, Mattay VS, Meyer-Lindenberg A, Egan MF, Weinberger DR, Callicott JH.	Am J Psychiatry. 2006 Nov;163(11):1969-77. doi: 10.1176/ajp.2006.163.11.1969.	Tan HY	Am J Psychiatry	2006	2006/11/01			10.1176/ajp.2006.163.11.1969	True	True	False	On request
25141213	Lead-induced impairments in the neural processes related to working memory function	Seo J, Lee BK, Jin SU, Park JW, Kim YT, Ryeom HK, Lee J, Suh KJ, Kim SH, Park SJ, Jeong KS, Ham JO, Kim Y, Chang Y.	PLoS One. 2014 Aug 20;9(8):e105308. doi: 10.1371/journal.pone.0105308. eCollection 2014.	Seo J	PLoS One	2014	2014/08/21	PMC4139362		10.1371/journal.pone.0105308	False	True	False	
26260309	Brief bursts of infrasound may improve cognitive function--an fMRI study	Weichenberger M, Kühler R, Bauer M, Hensel J, Brühl R, Ihlenfeld A, Ittermann B, Gallinat J, Koch C, Sander T, Kühn S.	Hear Res. 2015 Oct;328:87-93. doi: 10.1016/j.heares.2015.08.001. Epub 2015 Aug 7.	Weichenberger M	Hear Res	2015	2015/08/12			10.1016/j.heares.2015.08.001	False	False	False	
23614459	Structural correlates of impaired working memory in hippocampal sclerosis	Winston GP, Stretton J, Sidhu MK, Symms MR, Thompson PJ, Duncan JS.	Epilepsia. 2013 Jul;54(7):1143-53. doi: 10.1111/epi.12193. Epub 2013 Apr 24.	Winston GP	Epilepsia	2013	2013/04/26	PMC3806272		10.1111/epi.12193	False	True	False	
32848698	Maintenance vs. Manipulation in Auditory Verbal Working Memory in the Elderly: New Insights Based on Temporal Dynamics of Information Processing in the Millisecond Time Range	Jablonska K, Piotrowska M, Bednarek H, Szymaszek A, Marchewka A, Wypych M, Szelag E.	Front Aging Neurosci. 2020 Jul 23;12:194. doi: 10.3389/fnagi.2020.00194. eCollection 2020.	Jablonska K	Front Aging Neurosci	2020	2020/08/28	PMC7396649		10.3389/fnagi.2020.00194	True	True	False	On request
20123468	Disruption of prefrontal function and connectivity in individuals with phenylketonuria	Christ SE, Moffitt AJ, Peck D.	Mol Genet Metab. 2010;99 Suppl 1:S33-40. doi: 10.1016/j.ymgme.2009.09.014.	Christ SE	Mol Genet Metab	2010	2010/02/04			10.1016/j.ymgme.2009.09.014	False	False	False	
12880828	Cognitive effects of nicotine in humans: an fMRI study	Kumari V, Gray JA, ffytche DH, Mitterschiffthaler MT, Das M, Zachariah E, Vythelingum GN, Williams SC, Simmons A, Sharma T.	Neuroimage. 2003 Jul;19(3):1002-13. doi: 10.1016/s1053-8119(03)00110-1.	Kumari V	Neuroimage	2003	2003/07/26			10.1016/s1053-8119(03)00110-1	False	False	False	
27046110	Neural correlates of training and transfer effects in working memory in older adults	Heinzel S, Lorenz RC, Pelz P, Heinz A, Walter H, Kathmann N, Rapp MA, Stelzel C.	Neuroimage. 2016 Jul 1;134:236-249. doi: 10.1016/j.neuroimage.2016.03.068. Epub 2016 Apr 1.	Heinzel S	Neuroimage	2016	2016/04/06			10.1016/j.neuroimage.2016.03.068	False	False	False	
29376200	Intrinsic, stimulus-driven and task-dependent connectivity in human auditory cortex	Häkkinen S, Rinne T.	Brain Struct Funct. 2018 Jun;223(5):2113-2127. doi: 10.1007/s00429-018-1612-6. Epub 2018 Jan 29.	Häkkinen S	Brain Struct Funct	2018	2018/01/30			10.1007/s00429-018-1612-6	False	True	False	
25841662	Failure to deactivate medial prefrontal cortex in people at high risk for psychosis	Falkenberg I, Chaddock C, Murray RM, McDonald C, Modinos G, Bramon E, Walshe M, Broome M, McGuire P, Allen P.	Eur Psychiatry. 2015 Jul;30(5):633-40. doi: 10.1016/j.eurpsy.2015.03.003. Epub 2015 Apr 1.	Falkenberg I	Eur Psychiatry	2015	2015/04/06			10.1016/j.eurpsy.2015.03.003	False	False	False	
24916919	Neuroimaging and cognition using functional near infrared spectroscopy (fNIRS) in multiple sclerosis	Stojanovic-Radic J, Wylie G, Voelbel G, Chiaravalloti N, DeLuca J.	Brain Imaging Behav. 2015 Jun;9(2):302-11. doi: 10.1007/s11682-014-9307-y.	Stojanovic-Radic J	Brain Imaging Behav	2015	2014/06/12			10.1007/s11682-014-9307-y	False	True	False	
24453314	Working memory load-dependent brain response predicts behavioral training gains in older adults	Heinzel S, Lorenz RC, Brockhaus WR, Wüstenberg T, Kathmann N, Heinz A, Rapp MA.	J Neurosci. 2014 Jan 22;34(4):1224-33. doi: 10.1523/JNEUROSCI.2463-13.2014.	Heinzel S	J Neurosci	2014	2014/01/24	PMC6705311		10.1523/JNEUROSCI.2463-13.2014	False	True	False	
15955496	Cognitive control and brain resources in major depression: an fMRI study using the n-back task	Harvey PO, Fossati P, Pochon JB, Levy R, Lebastard G, Lehéricy S, Allilaire JF, Dubois B.	Neuroimage. 2005 Jul 1;26(3):860-9. doi: 10.1016/j.neuroimage.2005.02.048. Epub 2005 Apr 8.	Harvey PO	Neuroimage	2005	2005/06/16			10.1016/j.neuroimage.2005.02.048	False	False	False	
26640767	Classifying individuals at high-risk for psychosis based on functional brain activity during working memory processing	Bendfeldt K, Smieskova R, Koutsouleris N, Klöppel S, Schmidt A, Walter A, Harrisberger F, Wrege J, Simon A, Taschler B, Nichols T, Riecher-Rössler A, Lang UE, Radue EW, Borgwardt S.	Neuroimage Clin. 2015 Sep 30;9:555-63. doi: 10.1016/j.nicl.2015.09.015. eCollection 2015.	Bendfeldt K	Neuroimage Clin	2015	2015/12/08	PMC4625212		10.1016/j.nicl.2015.09.015	False	True	False	
27625614	Neural Plastic Effects of Working Memory Training Influenced by Self-perceived Stress in Stroke: A Case Illustration	Leung AW, Barrett LM, Butterworth D, Werther K, Dawson DR, Brintnell ES.	Front Psychol. 2016 Aug 30;7:1266. doi: 10.3389/fpsyg.2016.01266. eCollection 2016.	Leung AW	Front Psychol	2016	2016/09/15	PMC5003884		10.3389/fpsyg.2016.01266	False	True	False	
23807175	Gender differences in creative thinking: behavioral and fMRI findings	Abraham A, Thybusch K, Pieritz K, Hermann C.	Brain Imaging Behav. 2014 Mar;8(1):39-51. doi: 10.1007/s11682-013-9241-4.	Abraham A	Brain Imaging Behav	2014	2013/06/29			10.1007/s11682-013-9241-4	False	True	False	
11697932	Differential working memory load effects after mild traumatic brain injury	McAllister TW, Sparling MB, Flashman LA, Guerin SJ, Mamourian AC, Saykin AJ.	Neuroimage. 2001 Nov;14(5):1004-12. doi: 10.1006/nimg.2001.0899.	McAllister TW	Neuroimage	2001	2001/11/08			10.1006/nimg.2001.0899	False	False	False	
25458072	Impaired working memory in geriatric depression: an FMRI study	Dumas JA, Newhouse PA.	Am J Geriatr Psychiatry. 2015 Apr;23(4):433-436. doi: 10.1016/j.jagp.2014.09.011. Epub 2014 Oct 5.	Dumas JA	Am J Geriatr Psychiatry	2015	2014/12/03			10.1016/j.jagp.2014.09.011	False	False	False	
33528802	Altered functional network connectivity and working memory dysfunction in adolescents with epilepsy	Vannest J, Radhakrishnan R, Gutierrez-Colina AM, Wade SL, Maloney T, Combs A, Turnier L, Merder S, Altaye M, Tzipi-Horowitz-Kraus, Modi AC.	Brain Imaging Behav. 2021 Oct;15(5):2513-2523. doi: 10.1007/s11682-021-00452-5. Epub 2021 Feb 2.	Vannest J	Brain Imaging Behav	2021	2021/02/02			10.1007/s11682-021-00452-5	False	True	False	
18231790	Functional imaging studies of cognition using 99mTc-HMPAO SPECT: empirical validation using the n-back working memory paradigm	Ludwig C, Chicherio C, Terraneo L, Magistretti P, de Ribaupierre A, Slosman D.	Eur J Nucl Med Mol Imaging. 2008 Apr;35(4):695-703. doi: 10.1007/s00259-007-0635-7. Epub 2007 Dec 11.	Ludwig C	Eur J Nucl Med Mol Imaging	2008	2008/01/31	PMC2755766		10.1007/s00259-007-0635-7	False	True	False	
24222759	Quantification of Load Dependent Brain Activity in Parametric N-Back Working Memory Tasks using Pseudo-continuous Arterial Spin Labeling (pCASL) Perfusion Imaging	Zou Q, Gu H, Wang DJ, Gao JH, Yang Y.	J Cogn Sci (Seoul). 2011 Apr;12(2):127-210.	Zou Q	J Cogn Sci (Seoul)	2011	2013/11/14	PMC3821165	NIHMS522331		False	True	False	
24147643	Increased neural activity during high working memory load predicts low relapse risk in alcohol dependence	Charlet K, Beck A, Jorde A, Wimmer L, Vollstädt-Klein S, Gallinat J, Walter H, Kiefer F, Heinz A.	Addict Biol. 2014 May;19(3):402-14. doi: 10.1111/adb.12103. Epub 2013 Oct 22.	Charlet K	Addict Biol	2014	2013/10/24			10.1111/adb.12103	False	True	False	
33809905	Parental Education and Left Lateral Orbitofrontal Cortical Activity during N-Back Task: An fMRI Study of American Adolescents	Assari S, Boyce S, Saqib M, Bazargan M, Caldwell CH.	Brain Sci. 2021 Mar 22;11(3):401. doi: 10.3390/brainsci11030401.	Assari S	Brain Sci	2021	2021/04/03	PMC8004246		10.3390/brainsci11030401	True	True	False	
31386268	Does traditional asian vegetables (ulam) consumption correlate with brain activity using fMRI? A study among aging adults from low-income households	You YX, Shahar S, Mohamad M, Yahya HM, Haron H, Abdul Hamid H.	J Magn Reson Imaging. 2020 Apr;51(4):1142-1153. doi: 10.1002/jmri.26891. Epub 2019 Aug 6.	You YX	J Magn Reson Imaging	2020	2019/08/07	PMC7079031		10.1002/jmri.26891	False	True	False	
26086645	Task positive and default mode networks during a working memory in children with primary monosymptomatic nocturnal enuresis and healthy controls	Zhang K, Ma J, Lei D, Wang M, Zhang J, Du X.	Pediatr Res. 2015 Oct;78(4):422-9. doi: 10.1038/pr.2015.120. Epub 2015 Jun 18.	Zhang K	Pediatr Res	2015	2015/06/19			10.1038/pr.2015.120	False	True	False	
23125108	A meta-analysis of cerebellar contributions to higher cognition from PET and fMRI studies	E KH, Chen SH, Ho MH, Desmond JE.	Hum Brain Mapp. 2014 Feb;35(2):593-615. doi: 10.1002/hbm.22194. Epub 2012 Nov 5.	E KH	Hum Brain Mapp	2014	2012/11/06	PMC3866223	NIHMS496645	10.1002/hbm.22194	False	True	False	
17467956	A single 20 mg dose of dihydrexidine (DAR-0100), a full dopamine D1 agonist, is safe and tolerated in patients with schizophrenia	George MS, Molnar CE, Grenesko EL, Anderson B, Mu Q, Johnson K, Nahas Z, Knable M, Fernandes P, Juncos J, Huang X, Nichols DE, Mailman RB.	Schizophr Res. 2007 Jul;93(1-3):42-50. doi: 10.1016/j.schres.2007.03.011. Epub 2007 Apr 30.	George MS	Schizophr Res	2007	2007/05/01			10.1016/j.schres.2007.03.011	False	False	False	
26083786	Study of behavioural and neural bases of visuo-spatial working memory with an fMRI paradigm based on an n-back task	Dores AR, Barbosa F, Carvalho IP, Almeida I, Guerreiro S, da Rocha BM, de Sousa L, Castro-Caldas A.	J Neuropsychol. 2017 Mar;11(1):122-134. doi: 10.1111/jnp.12076. Epub 2015 Jun 17.	Dores AR	J Neuropsychol	2017	2015/06/18			10.1111/jnp.12076	False	True	False	
27401793	A cognitive fMRI study in non-manifesting LRRK2 and GBA carriers	Bregman N, Thaler A, Mirelman A, Helmich RC, Gurevich T, Orr-Urtreger A, Marder K, Bressman S, Bloem BR, Giladi N; LRRK2 Ashkenazi Jewish consortium.	Brain Struct Funct. 2017 Apr;222(3):1207-1218. doi: 10.1007/s00429-016-1271-4. Epub 2016 Jul 11.	Bregman N	Brain Struct Funct	2017	2016/07/13			10.1007/s00429-016-1271-4	False	True	False	
32764344	Family Income Mediates the Effect of Parental Education on Adolescents' Hippocampus Activation During an N-Back Memory Task	Assari S, Boyce S, Bazargan M, Caldwell CH.	Brain Sci. 2020 Aug 5;10(8):520. doi: 10.3390/brainsci10080520.	Assari S	Brain Sci	2020	2020/08/09	PMC7464386		10.3390/brainsci10080520	True	True	False	
25961587	FMRI of visual working memory in high school football players	Shenk TE, Robinson ME, Svaldi DO, Abbas K, Breedlove KM, Leverenz LJ, Nauman EA, Talavage TM.	Dev Neuropsychol. 2015;40(2):63-8. doi: 10.1080/87565641.2015.1014088.	Shenk TE	Dev Neuropsychol	2015	2015/05/12			10.1080/87565641.2015.1014088	False	True	False	
28466438	A mechanistic cohort study evaluating cognitive impairment in women treated for breast cancer	Vardy JL, Stouten-Kemperman MM, Pond G, Booth CM, Rourke SB, Dhillon HM, Dodd A, Crawley A, Tannock IF.	Brain Imaging Behav. 2019 Feb;13(1):15-26. doi: 10.1007/s11682-017-9728-5.	Vardy JL	Brain Imaging Behav	2019	2017/05/04			10.1007/s11682-017-9728-5	False	True	False	
19524048	Evidence of a modality-dependent role of the cerebellum in working memory? An fMRI study comparing verbal and abstract n-back tasks	Hautzel H, Mottaghy FM, Specht K, Müller HW, Krause BJ.	Neuroimage. 2009 Oct 1;47(4):2073-82. doi: 10.1016/j.neuroimage.2009.06.005. Epub 2009 Jun 11.	Hautzel H	Neuroimage	2009	2009/06/16			10.1016/j.neuroimage.2009.06.005	False	False	False	
26496261	BDNF Val66Met Polymorphism on Functional MRI During n-Back Working Memory Tasks	Chen CC, Chen CJ, Wu D, Chi NF, Chen PC, Liao YP, Chiu HW, Hu CJ.	Medicine (Baltimore). 2015 Oct;94(42):e1586. doi: 10.1097/MD.0000000000001586.	Chen CC	Medicine (Baltimore)	2015	2015/10/27	PMC4620795		10.1097/MD.0000000000001586	False	True	False	
29268260	Decreased Fronto-Parietal and Increased Default Mode Network Activation is Associated with Subtle Cognitive Deficits in Elderly Controls	Zanchi D, Montandon ML, Sinanaj I, Rodriguez C, Depoorter A, Herrmann FR, Borgwardt S, Giannakopoulos P, Haller S.	Neurosignals. 2017;25(1):127-138. doi: 10.1159/000486152. Epub 2017 Dec 18.	Zanchi D	Neurosignals	2017	2017/12/22			10.1159/000486152	False	True	False	
27448153	Structural and Functional Brain Correlates of Cognitive Impairment in Euthymic Patients with Bipolar Disorder	Alonso-Lana S, Goikolea JM, Bonnin CM, Sarró S, Segura B, Amann BL, Monté GC, Moro N, Fernandez-Corcuera P, Maristany T, Salvador R, Vieta E, Pomarol-Clotet E, McKenna PJ.	PLoS One. 2016 Jul 22;11(7):e0158867. doi: 10.1371/journal.pone.0158867. eCollection 2016.	Alonso-Lana S	PLoS One	2016	2016/07/23	PMC4957815		10.1371/journal.pone.0158867	True	True	False	
26833223	Neural correlates of working memory training in HIV patients: study protocol for a randomized controlled trial	Chang L, Løhaugen GC, Douet V, Miller EN, Skranes J, Ernst T.	Trials. 2016 Feb 2;17:62. doi: 10.1186/s13063-016-1160-4.	Chang L	Trials	2016	2016/02/03	PMC4736265		10.1186/s13063-016-1160-4	False	True	False	
32566704	A neuroimaging dataset on working memory and reward processing in children with and without ADHD	Lytle MN, Hammer R, Booth JR.	Data Brief. 2020 Jun 2;31:105801. doi: 10.1016/j.dib.2020.105801. eCollection 2020 Aug.	Lytle MN	Data Brief	2020	2020/06/23	PMC7298646		10.1016/j.dib.2020.105801	False	True	False	
32174288	Neurocognitive correlates of working memory and emotional processing in postpartum psychosis: an fMRI study	Kowalczyk OS, Pauls AM, Fusté M, Williams SCR, Hazelgrove K, Vecchio C, Seneviratne G, Pariante CM, Dazzan P, Mehta MA.	Psychol Med. 2021 Jul;51(10):1724-1732. doi: 10.1017/S0033291720000471. Epub 2020 Mar 16.	Kowalczyk OS	Psychol Med	2021	2020/03/17			10.1017/S0033291720000471	True	False	False	
19678593	Does the default-mode functional connectivity of the brain correlate with working-memory performances?	Esposito F, Aragri A, Latorre V, Popolizio T, Scarabino T, Cirillo S, Marciano E, Tedeschi G, Di Salle F.	Arch Ital Biol. 2009 Mar;147(1-2):11-20.	Esposito F	Arch Ital Biol	2009	2009/08/15				False	False	False	
23595762	Application of high-frequency repetitive transcranial magnetic stimulation to the DLPFC alters human prefrontal-hippocampal functional interaction	Bilek E, Schäfer A, Ochs E, Esslinger C, Zangl M, Plichta MM, Braun U, Kirsch P, Schulze TG, Rietschel M, Meyer-Lindenberg A, Tost H.	J Neurosci. 2013 Apr 17;33(16):7050-6. doi: 10.1523/JNEUROSCI.3081-12.2013.	Bilek E	J Neurosci	2013	2013/04/19	PMC6618883		10.1523/JNEUROSCI.3081-12.2013	False	True	False	
20714062	An fMRI study of intra-individual functional topography in the human cerebellum	Stoodley CJ, Valera EM, Schmahmann JD.	Behav Neurol. 2010;23(1-2):65-79. doi: 10.3233/BEN-2010-0268.	Stoodley CJ	Behav Neurol	2010	2010/08/18	PMC3776583	NIHMS501705	10.3233/BEN-2010-0268	False	True	False	
32388347	Greater Individual Variability in Functional Brain Activity during Working Memory Performance in young people with Autism and Executive Function Impairment	Hawco C, Yoganathan L, Voineskos AN, Lyon R, Tan T, Daskalakis ZJ, Blumberger DM, Croarkin PE, Lai MC, Szatmari P, Ameis SH.	Neuroimage Clin. 2020;27:102260. doi: 10.1016/j.nicl.2020.102260. Epub 2020 Apr 23.	Hawco C	Neuroimage Clin	2020	2020/05/11	PMC7218076		10.1016/j.nicl.2020.102260	False	True	True	
28376413	Neurophysiological capacity in a working memory task differentiates dependent from nondependent heavy drinkers and controls	Wesley MJ, Lile JA, Fillmore MT, Porrino LJ.	Drug Alcohol Depend. 2017 Jun 1;175:24-35. doi: 10.1016/j.drugalcdep.2017.01.029. Epub 2017 Mar 21.	Wesley MJ	Drug Alcohol Depend	2017	2017/04/05	PMC5425311	NIHMS861837	10.1016/j.drugalcdep.2017.01.029	False	True	False	
24371792	The effects of tetrahydrobiopterin (BH4) treatment on brain function in individuals with phenylketonuria	Christ SE, Moffitt AJ, Peck D, White DA.	Neuroimage Clin. 2013 Aug 30;3:539-47. doi: 10.1016/j.nicl.2013.08.012. eCollection 2013.	Christ SE	Neuroimage Clin	2013	2013-12-28	PMC3871382		10.1016/j.nicl.2013.08.012	False	True	False	
26586814	Default Mode Dynamics for Global Functional Integration	Vatansever D, Menon DK, Manktelow AE, Sahakian BJ, Stamatakis EA.	J Neurosci. 2015 Nov 18;35(46):15254-62. doi: 10.1523/JNEUROSCI.2135-15.2015.	Vatansever D	J Neurosci	2015	2015-11-21	PMC4649001		10.1523/JNEUROSCI.2135-15.2015	False	True	False	
34099922	Baseline brain function in the preadolescents of the ABCD Study	Chaarani B, Hahn S, Allgaier N, Adise S, Owens MM, Juliano AC, Yuan DK, Loso H, Ivanciu A, Albaugh MD, Dumas J, Mackey S, Laurent J, Ivanova M, Hagler DJ, Cornejo MD, Hatton S, Agrawal A, Aguinaldo L, Ahonen L, Aklin W, Anokhin AP, Arroyo J, Avenevoli S, Babcock D, Bagot K, Baker FC, Banich MT, Barch DM, Bartsch H, Baskin-Sommers A, Bjork JM, Blachman-Demner D, Bloch M, Bogdan R, Bookheimer SY, Breslin F, Brown S, Calabro FJ, Calhoun V, Casey BJ, Chang L, Clark DB, Cloak C, Constable RT, Constable K, Corley R, Cottler LB, Coxe S, Dagher RK, Dale AM, Dapretto M, Delcarmen-Wiggins R, Dick AS, Do EK, Dosenbach NUF, Dowling GJ, Edwards S, Ernst TM, Fair DA, Fan CC, Feczko E, Feldstein-Ewing SW, Florsheim P, Foxe JJ, Freedman EG, Friedman NP, Friedman-Hill S, Fuemmeler BF, Galvan A, Gee DG, Giedd J, Glantz M, Glaser P, Godino J, Gonzalez M, Gonzalez R, Grant S, Gray KM, Haist F, Harms MP, Hawes S, Heath AC, Heeringa S, Heitzeg MM, Hermosillo R, Herting MM, Hettema JM, Hewitt JK, Heyser C, Hoffman E, Howlett K, Huber RS, Huestis MA, Hyde LW, Iacono WG, Infante MA, Irfanoglu O, Isaiah A, Iyengar S, et al.	Nat Neurosci. 2021 Aug;24(8):1176-1186. doi: 10.1038/s41593-021-00867-9. Epub 2021 Jun 7.	Chaarani B	Nat Neurosci	2021	2021-06-08			10.1038/s41593-021-00867-9	True	False	True	Data from ABCD study. GitHub repo says partial code
30890968	Decreased Response to Positive Facial Affect in a Depressed Cohort in the Dorsal Striatum During a Working Memory Task-A Preliminary fMRI Study	Goodin P, Lamp G, Hughes ME, Rossell SL, Ciorciari J.	Front Psychiatry. 2019 Mar 5;10:60. doi: 10.3389/fpsyt.2019.00060. eCollection 2019.	Goodin P	Front Psychiatry	2019	2019-03-21	PMC6411826		10.3389/fpsyt.2019.00060	False	True	True	Resampling helper functions only, not main analysis code
21296712	Occupational solvent exposure and brain function: an fMRI study	Tang CY, Carpenter DM, Eaves EL, Ng J, Ganeshalingam N, Weisel C, Qian H, Lange G, Fiedler NL.	Environ Health Perspect. 2011 Jul;119(7):908-13. doi: 10.1289/ehp.1002529. Epub 2011 Feb 4.	Tang CY	Environ Health Perspect	2011	2011-02-08	PMC3222975		10.1289/ehp.1002529	False	True	False	
33982247	The regulatory roles of progesterone and estradiol on emotion processing in women	Sharma R, Cameron A, Fang Z, Ismail N, Smith A.	Cogn Affect Behav Neurosci. 2021 Oct;21(5):1026-1038. doi: 10.3758/s13415-021-00908-7. Epub 2021 May 13.	Sharma R	Cogn Affect Behav Neurosci	2021	2021-05-13			10.3758/s13415-021-00908-7	False	False	False	
29415163	Genetic Variation of a DRD2 Co-expression Network is Associated with Changes in Prefrontal Function After D2 Receptors Stimulation	Selvaggi P, Pergola G, Gelao B, Di Carlo P, Nettis MA, Amico G, Fazio L, Rampino A, Sambataro F, Blasi G, Bertolino A.	Cereb Cortex. 2019 Mar 1;29(3):1162-1173. doi: 10.1093/cercor/bhy022.	Selvaggi P	Cereb Cortex	2019	2018-02-08			10.1093/cercor/bhy022	False	True	False	
27621193	Dietary saturated fat and monounsaturated fat have reversible effects on brain function and the secretion of pro-inflammatory cytokines in young women	Dumas JA, Bunn JY, Nickerson J, Crain KI, Ebenstein DB, Tarleton EK, Makarewicz J, Poynter ME, Kien CL.	Metabolism. 2016 Oct;65(10):1582-8. doi: 10.1016/j.metabol.2016.08.003. Epub 2016 Aug 9.	Dumas JA	Metabolism	2016	2016-09-14	PMC5023067	NIHMS809511	10.1016/j.metabol.2016.08.003	False	False	False	
23511846	Hemispheric lateralization of verbal and spatial working memory during adolescence	Nagel BJ, Herting MM, Maxwell EC, Bruno R, Fair D.	Brain Cogn. 2013 Jun;82(1):58-68. doi: 10.1016/j.bandc.2013.02.007. Epub 2013 Mar 16.	Nagel BJ	Brain Cogn	2013	2013-03-21	PMC3652620	NIHMS459431	10.1016/j.bandc.2013.02.007	False	False	False	
28750832	Functional brain activation associated with working memory training and transfer	Clark CM, Lawlor-Savage L, Goghari VM.	Behav Brain Res. 2017 Sep 15;334:34-49. doi: 10.1016/j.bbr.2017.07.030. Epub 2017 Jul 24.	Clark CM	Behav Brain Res	2017	2017-07-29			10.1016/j.bbr.2017.07.030	False	False	False	
27261878	Prefrontal activity during working memory is modulated by the interaction of variation in CB1 and COX2 coding genes and correlates with frequency of cannabis use	Taurisano P, Antonucci LA, Fazio L, Rampino A, Romano R, Porcelli A, Masellis R, Colizzi M, Quarto T, Torretta S, Di Giorgio A, Pergola G, Bertolino A, Blasi G.	Cortex. 2016 Aug;81:231-8. doi: 10.1016/j.cortex.2016.05.010. Epub 2016 May 21.	Taurisano P	Cortex	2016	2016-06-05			10.1016/j.cortex.2016.05.010				
25151425	Reduced prefrontal efficiency for visuospatial working memory in attention-deficit/hyperactivity disorder	Bédard AC, Newcorn JH, Clerkin SM, Krone B, Fan J, Halperin JM, Schulz KP.	J Am Acad Child Adolesc Psychiatry. 2014 Sep;53(9):1020-1030.e6. doi: 10.1016/j.jaac.2014.05.011. Epub 2014 Jun 19.	Bédard AC	J Am Acad Child Adolesc Psychiatry	2014	2014-08-25			10.1016/j.jaac.2014.05.011				
21040792	Abnormal brain activation during working memory in children with prenatal exposure to drugs of abuse: the effects of methamphetamine, alcohol, and polydrug exposure	Roussotte FF, Bramen JE, Nunez SC, Quandt LC, Smith L, O'Connor MJ, Bookheimer SY, Sowell ER.	Neuroimage. 2011 Feb 14;54(4):3067-75. doi: 10.1016/j.neuroimage.2010.10.072. Epub 2010 Oct 30.	Roussotte FF	Neuroimage	2011	2010-11-03	PMC4405109	NIHMS249539	10.1016/j.neuroimage.2010.10.072				
21044687	Changes in brain network activity during working memory tasks: a magnetoencephalography study	Brookes MJ, Wood JR, Stevenson CM, Zumer JM, White TP, Liddle PF, Morris PG.	Neuroimage. 2011 Apr 15;55(4):1804-15. doi: 10.1016/j.neuroimage.2010.10.074. Epub 2010 Oct 31.	Brookes MJ	Neuroimage	2011	2010-11-04	PMC6485426	EMS34031	10.1016/j.neuroimage.2010.10.074				
33949299	Detecting the Inverted-U in fMRI Studies of Schizophrenia: A Comparison of Three Analysis Methods	Thomas ML, Duffy JR, Swerdlow N, Light GA, Brown GG.	J Int Neuropsychol Soc. 2021 May 5:1-12. doi: 10.1017/S1355617721000424. Online ahead of print.	Thomas ML	J Int Neuropsychol Soc	2021	2021-05-05	PMC8568731	NIHMS1686761	10.1017/S1355617721000424				
32364670	"Toward a \treadmill test\"" for cognition: Improved prediction of general cognitive ability from the task activated brain"""	Sripada C, Angstadt M, Rutherford S, Taxali A, Shedden K.	Hum Brain Mapp. 2020 Aug 15;41(12):3186-3197. doi: 10.1002/hbm.25007. Epub 2020 May 4.	Sripada C	Hum Brain Mapp	2020	2020-05-05	PMC7375130		10.1002/hbm.25007				
22711376	Intrinsic resting-state activity predicts working memory brain activation and behavioral performance	Zou Q, Ross TJ, Gu H, Geng X, Zuo XN, Hong LE, Gao JH, Stein EA, Zang YF, Yang Y.	Hum Brain Mapp. 2013 Dec;34(12):3204-15. doi: 10.1002/hbm.22136. Epub 2012 Jun 19.	Zou Q	Hum Brain Mapp	2013	2012-06-20	PMC6870161		10.1002/hbm.22136				
26441819	Pushing the Limits: Chronotype and Time of Day Modulate Working Memory-Dependent Cerebral Activity	Schmidt C, Collette F, Reichert CF, Maire M, Vandewalle G, Peigneux P, Cajochen C.	Front Neurol. 2015 Sep 25;6:199. doi: 10.3389/fneur.2015.00199. eCollection 2015.	Schmidt C	Front Neurol	2015	2015-10-07	PMC4585243		10.3389/fneur.2015.00199				
25268790	"Increased orbitofrontal cortex activation associated with \pro-obsessive\"" antipsychotic treatment in patients with schizophrenia"""	Schirmbeck F, Mier D, Esslinger C, Rausch F, Englisch S, Eifler S, Meyer-Lindenberg A, Kirsch P, Zink M.	J Psychiatry Neurosci. 2015 Mar;40(2):89-99. doi: 10.1503/jpn.140021.	Schirmbeck F	J Psychiatry Neurosci	2015	2014-10-01	PMC4354822		10.1503/jpn.140021				
31898277	Longitudinal Increases in Cerebral Brain Activation During Working Memory Performance in Friedreich Ataxia: 24-Month Data from IMAGE-FRDA	Shishegar R, Harding IH, Corben LA, Delatycki MB, Storey E, Egan GF, Georgiou-Karistianis N.	Cerebellum. 2020 Apr;19(2):182-191. doi: 10.1007/s12311-019-01094-6.	Shishegar R	Cerebellum	2020	2020-01-04			10.1007/s12311-019-01094-6				
32328915	Brain bases of recovery following cognitive rehabilitation for traumatic brain injury: a preliminary study	Gimbel SI, Ettenhofer ML, Cordero E, Roy M, Chan L.	Brain Imaging Behav. 2021 Feb;15(1):410-420. doi: 10.1007/s11682-020-00269-8.	Gimbel SI	Brain Imaging Behav	2021	2020-04-25			10.1007/s11682-020-00269-8				
34047384	Functional brain changes associated with cognitive trajectories determine specific tDCS-induced effects among older adults	Vaqué-Alcázar L, Abellaneda-Pérez K, Solé-Padullés C, Bargalló N, Valls-Pedret C, Ros E, Sala-Llonch R, Bartrés-Faz D.	J Neurosci Res. 2021 Sep;99(9):2188-2200. doi: 10.1002/jnr.24849. Epub 2021 May 28.	Vaqué-Alcázar L	J Neurosci Res	2021	2021-05-28			10.1002/jnr.24849				
